{"$schema":"https://json-schema.org/draft/2020-12/schema","type":"object","required":["job_id","plan_summary","tasks","approvals_required"],"properties":{"job_id":{"type":"string"},"plan_summary":{"type":"string"},"tasks":{"type":"array","items":{"type":"object","required":["task_key","output_type","depends_on"],"properties":{"task_key":{"type":"string"},"output_type":{"type":"string"},"depends_on":{"type":"array","items":{"type":"string"}}}}},"approvals_required":{"type":"array","items":{"type":"string"}}}}
