{"job_id":"00000000-0000-0000-0000-000000000001","plan_summary":"Two-week launch cadence across social/email/blog.","tasks":[{"task_key":"social_week1","output_type":"social_posts","depends_on":[]},{"task_key":"email_week1","output_type":"email_copy","depends_on":[]}],"approvals_required":["analysis","plan","final_delivery"]}
